{
  "$schema": "../../schemas/recipe.schema.json",
  "slug": "memory-with-langgraph",
  "order": 5,
  "eyebrow": "Memory",
  "title": "Memory with LangGraph",
  "upcoming": true,
  "tagline": "Give your agent short-term thread memory and long-term user context with LangGraph.",
  "difficulty": "intermediate",
  "estimatedReadingTime": "12 min",
  "estimatedRunTime": "6 min",
  "stack": {
    "primary": ["nebius-agentkit", "langgraph"],
    "secondary": ["fastapi", "openai-sdk", "structlog", "prometheus", "docker"]
  },
  "tags": ["agent", "memory", "langgraph", "personalization", "streaming", "sessions"],
  "story": {
    "problem": "The LangGraph agent can orchestrate a request, but it still forgets conversation threads and user context unless memory is modeled explicitly.",
    "solution": "Use LangGraph checkpointers for short-term thread memory and LangGraph stores for long-term user or application memory, then recall bounded context before the Nebius model writes.",
    "outcome": "A stateful agent that can continue a thread and personalize across sessions without pushing memory management into the FastAPI route."
  },
  "prerequisites": [
    "Python 3.12+",
    "uv installed (https://docs.astral.sh/uv/)",
    "A Nebius API key",
    "Docker (optional)"
  ],
  "models": [
    { "id": "meta-llama/Llama-3.3-70B-Instruct", "role": "primary" }
  ],
  "assets": {
    "hero": "assets/hero.png"
  },
  "quickstart": {
    "clone": "git clone https://github.com/csauvage/nebius-cookbook && cd nebius-cookbook/cookbooks/05-memory-with-langgraph",
    "configure": "cp .env.example .env  # then fill NEBIUS_API_KEY",
    "run": "uv sync && make dev"
  },
  "endpoints": [
    {
      "method": "POST",
      "path": "/agent/run",
      "streaming": true,
      "description": "Run the agent with thread and long-term memory recall, then stream SSE events back."
    },
    {
      "method": "GET",
      "path": "/memory/{user_id}",
      "description": "List the long-term memories stored for a user."
    },
    {
      "method": "DELETE",
      "path": "/memory/{user_id}",
      "description": "Delete the long-term memories stored for a user."
    },
    {
      "method": "DELETE",
      "path": "/threads/{thread_id}",
      "description": "Delete short-term checkpoints for a conversation thread."
    },
    {
      "method": "GET",
      "path": "/healthz",
      "description": "Liveness probe."
    },
    {
      "method": "GET",
      "path": "/readyz",
      "description": "Readiness probe."
    },
    {
      "method": "GET",
      "path": "/metrics",
      "description": "Prometheus metrics scrape endpoint."
    }
  ],
  "deployment": {
    "target": "nebius-compute",
    "instructions": "docs/deployment.md"
  },
  "nextRecipe": "hardening-agents-guardrails",
  "authors": [
    { "name": "Clément Sauvage", "url": "https://clementsauvage.me" }
  ],
  "publishedAt": "2026-06-04",
  "updatedAt": "2026-05-20"
}
