{
  "$schema": "../../schemas/recipe.schema.json",
  "slug": "hardening-agents-guardrails",
  "order": 6,
  "eyebrow": "Reliability",
  "title": "Hardening Agents with Guardrails",
  "upcoming": true,
  "tagline": "Stop your agent leaking, hallucinating, or going off-script: validated I/O with Guardrails.",
  "difficulty": "advanced",
  "estimatedReadingTime": "14 min",
  "estimatedRunTime": "6 min",
  "stack": {
    "primary": ["nebius-agentkit", "guardrails-ai"],
    "secondary": ["fastapi", "structlog", "prometheus", "docker"]
  },
  "tags": ["agent", "guardrails", "validation", "safety", "reliability", "pii"],
  "story": {
    "problem": "A capable agent is also a liability: it can leak PII, emit unsafe content, drift off-topic, or return malformed output that breaks downstream code.",
    "solution": "Wrap the agent in Guardrails: input validators (PII, prompt-injection, topic) and output validators (schema, toxicity, groundedness) that run on every request, with a re-ask loop when a check fails.",
    "outcome": "An agent you can put in front of real users — one that fails closed, scrubs sensitive data, and guarantees the shape of what it returns."
  },
  "prerequisites": [
    "Python 3.12+",
    "uv installed (https://docs.astral.sh/uv/)",
    "A Nebius API key",
    "Docker (optional)"
  ],
  "models": [
    { "id": "meta-llama/Llama-3.3-70B-Instruct", "role": "primary" },
    { "id": "Qwen/Qwen3-30B-A3B-Instruct", "role": "critic" },
    { "id": "Qwen/Qwen3-Embedding-8B", "role": "embed" }
  ],
  "quickstart": {
    "clone": "git clone https://github.com/csauvage/nebius-cookbook && cd nebius-cookbook/cookbooks/06-hardening-agents-guardrails",
    "configure": "cp .env.example .env  # then fill NEBIUS_API_KEY",
    "run": "uv sync && make dev"
  },
  "endpoints": [
    {
      "method": "POST",
      "path": "/agent/run",
      "streaming": true,
      "description": "Run the guarded agent — validated input and output — and stream SSE events back."
    },
    {
      "method": "GET",
      "path": "/healthz",
      "description": "Liveness probe."
    },
    {
      "method": "GET",
      "path": "/readyz",
      "description": "Readiness probe."
    },
    {
      "method": "GET",
      "path": "/metrics",
      "description": "Prometheus metrics scrape endpoint, including guardrail pass/fail counters."
    }
  ],
  "deployment": {
    "target": "nebius-compute",
    "instructions": "docs/deployment.md"
  },
  "nextRecipe": "stress-testing-agents-snowglobe",
  "authors": [
    { "name": "Clément Sauvage", "url": "https://clementsauvage.me" }
  ],
  "publishedAt": "2026-06-04",
  "updatedAt": "2026-05-16"
}
