{
  "$schema": "../../schemas/recipe.schema.json",
  "slug": "testing-before-production-snowglobe",
  "order": 10,
  "eyebrow": "Simulation",
  "title": "Testing Before Production with Snowglobe",
  "upcoming": true,
  "tagline": "Generate scenarios, run conversations, and score failures before users find them.",
  "difficulty": "advanced",
  "estimatedReadingTime": "14 min",
  "estimatedRunTime": "10 min",
  "stack": {
    "primary": ["nebius-agentkit", "snowglobe"],
    "secondary": ["langsmith", "mcp", "stripe", "fastapi", "structlog", "prometheus", "docker"]
  },
  "tags": ["agent", "testing", "simulation", "evaluation", "snowglobe", "ci", "actions"],
  "story": {
    "problem": "An action-capable agent can still fail on conversations and approval paths you did not think to hand-test.",
    "solution": "Use Snowglobe to generate synthetic personas and scenarios, run them against the complete agent at scale, and score transcripts for regressions and action-safety failures.",
    "outcome": "A repeatable simulation harness that gives pre-release evidence before the complete agent reaches users."
  },
  "prerequisites": [
    "Python 3.12+",
    "uv installed (https://docs.astral.sh/uv/)",
    "A Nebius API key",
    "A LangSmith API key (https://docs.langchain.com/langsmith/home)",
    "A Stripe test-mode API key for live action scenarios",
    "Docker (optional)"
  ],
  "models": [
    { "id": "meta-llama/Llama-3.3-70B-Instruct", "role": "primary" },
    { "id": "Qwen/Qwen3-30B-A3B-Instruct", "role": "critic" }
  ],
  "quickstart": {
    "clone": "git clone https://github.com/csauvage/nebius-cookbook && cd nebius-cookbook/cookbooks/10-testing-before-production-snowglobe",
    "configure": "cp .env.example .env  # then fill NEBIUS_API_KEY, LANGSMITH_API_KEY, and STRIPE_SECRET_KEY for live action scenarios",
    "run": "uv sync && make dev"
  },
  "endpoints": [
    {
      "method": "POST",
      "path": "/agent/run",
      "streaming": true,
      "description": "Run the agent under test and stream SSE events back."
    },
    {
      "method": "POST",
      "path": "/simulate",
      "description": "Launch a Snowglobe simulation batch against the agent and return scored results."
    },
    {
      "method": "GET",
      "path": "/healthz",
      "description": "Liveness probe."
    },
    {
      "method": "GET",
      "path": "/readyz",
      "description": "Readiness probe."
    },
    {
      "method": "GET",
      "path": "/metrics",
      "description": "Prometheus metrics scrape endpoint."
    }
  ],
  "deployment": {
    "target": "nebius-compute",
    "instructions": "docs/deployment.md"
  },
  "authors": [
    { "name": "Clément Sauvage", "url": "https://clementsauvage.me" }
  ],
  "publishedAt": "2026-06-04",
  "updatedAt": "2026-05-26"
}
